{
  "slug": "security-plus",
  "code": "SY0-701",
  "name": "CompTIA Security+",
  "vendor": "CompTIA",
  "domains": {
    "D1": { "name": "General security concepts", "weight": "12%", "pct": 12 },
    "D2": { "name": "Threats, vulnerabilities, and mitigations", "weight": "22%", "pct": 22 },
    "D3": { "name": "Security architecture", "weight": "18%", "pct": 18 },
    "D4": { "name": "Security operations", "weight": "28%", "pct": 28 },
    "D5": { "name": "Security program management and oversight", "weight": "20%", "pct": 20 }
  },
  "scoring": { "min": 100, "max": 900, "pass": 750 },
  "minutesPerQuestion": 1,
  "defaultSize": 90,
  "sizeOptions": [30, 60, 90],
  "realExamNote": "The real exam has up to 90 questions in 90 minutes, including performance-based questions; this simulator is multiple choice only. SY0-701 is available until June 11, 2027.",
  "scoreNote": "CompTIA's real scoring is scaled differently, so treat 750+ as a readiness signal, not a guarantee."
}
