{
  "slug": "ccst-cybersecurity",
  "code": "100-160",
  "name": "Cisco Certified Support Technician Cybersecurity",
  "vendor": "Cisco",
  "domains": {
    "D1": {
      "name": "Essential security principles",
      "weight": "—",
      "pct": 20
    },
    "D2": {
      "name": "Basic network security concepts",
      "weight": "—",
      "pct": 20
    },
    "D3": {
      "name": "Endpoint security concepts",
      "weight": "—",
      "pct": 20
    },
    "D4": {
      "name": "Vulnerability assessment and risk management",
      "weight": "—",
      "pct": 20
    },
    "D5": {
      "name": "Incident handling",
      "weight": "—",
      "pct": 20
    }
  },
  "scoring": {
    "min": 0,
    "max": 100,
    "pass": 70
  },
  "minutesPerQuestion": 1,
  "defaultSize": 50,
  "sizeOptions": [
    15,
    30,
    50
  ],
  "realExamNote": "The real exam is 50 minutes. Cisco doesn't publish domain weights for CCST exams, so domains are weighted evenly here.",
  "scoreNote": "Cisco doesn't publish a passing score for CCST exams, so 70% is used here as a readiness target."
}
