{
  "slug": "network-plus",
  "code": "N10-009",
  "name": "CompTIA Network+",
  "vendor": "CompTIA",
  "domains": {
    "D1": { "name": "Networking concepts", "weight": "23%", "pct": 23 },
    "D2": { "name": "Network implementation", "weight": "20%", "pct": 20 },
    "D3": { "name": "Network operations", "weight": "19%", "pct": 19 },
    "D4": { "name": "Network security", "weight": "14%", "pct": 14 },
    "D5": { "name": "Network troubleshooting", "weight": "24%", "pct": 24 }
  },
  "scoring": { "min": 100, "max": 900, "pass": 720 },
  "minutesPerQuestion": 1,
  "defaultSize": 90,
  "sizeOptions": [30, 60, 90],
  "realExamNote": "The real exam has up to 90 questions in 90 minutes, including performance-based questions; this simulator is multiple choice only.",
  "scoreNote": "CompTIA's real scoring is scaled differently, so treat 720+ as a readiness signal, not a guarantee."
}
