{
  "slug": "dp-900",
  "code": "DP-900",
  "name": "Microsoft Azure Data Fundamentals",
  "vendor": "Microsoft",
  "domains": {
    "D1": {
      "name": "Core data concepts",
      "weight": "25–30%",
      "pct": 27
    },
    "D2": {
      "name": "Relational data on Azure",
      "weight": "20–25%",
      "pct": 23
    },
    "D3": {
      "name": "Non-relational data on Azure",
      "weight": "15–20%",
      "pct": 18
    },
    "D4": {
      "name": "Analytics workloads",
      "weight": "25–30%",
      "pct": 27
    }
  },
  "scoring": {
    "min": 0,
    "max": 1000,
    "pass": 700
  },
  "minutesPerQuestion": 1,
  "defaultSize": 45,
  "sizeOptions": [
    15,
    30,
    45
  ],
  "realExamNote": "Based on the DP-900 skills measured as of July 21, 2026. The real exam is 45 minutes with roughly 40–60 questions.",
  "scoreNote": "Microsoft uses scaled scoring, so treat 700+ as a readiness signal, not a guarantee."
}
