{
  "slug": "google-adp",
  "code": "ADP",
  "name": "Google Associate Data Practitioner",
  "vendor": "Google Cloud",
  "domains": {
    "D1": {
      "name": "Data preparation and ingestion",
      "weight": "~30%",
      "pct": 30
    },
    "D2": {
      "name": "Data analysis and presentation",
      "weight": "~27%",
      "pct": 27
    },
    "D3": {
      "name": "Data pipeline orchestration",
      "weight": "~18%",
      "pct": 18
    },
    "D4": {
      "name": "Data management",
      "weight": "~25%",
      "pct": 25
    }
  },
  "scoring": {
    "min": 0,
    "max": 100,
    "pass": 70
  },
  "minutesPerQuestion": 2,
  "defaultSize": 50,
  "sizeOptions": [
    20,
    35,
    50
  ],
  "realExamNote": "The real exam has 50–60 questions in 2 hours.",
  "scoreNote": "Google doesn't publish a passing score, so 70% is used here as a readiness target."
}
